{"$defs":{"sha256":{"pattern":"^sha256:(?!0{64}$)[0-9a-f]{64}$","type":"string"}},"$id":"schema://governance/production-qc-collector-policy-source/1.0.0","$schema":"https://json-schema.org/draft/2020-12/schema","additionalProperties":false,"properties":{"collector_registry_sha256":{"$ref":"#/$defs/sha256","const":"sha256:285cbd72a611ea4fe3bded0a2dd0774a90b89fc3f52eeef146ecc03150c18e7e"},"fixed_environment_sha256":{"$ref":"#/$defs/sha256","const":"sha256:1d36b32cd19a15c1e5d98f1ac689b632b8ebde9a41a24cbb0185844a13728e78"},"profile_id":{"const":"production-av-qc-v1"},"registry_snapshot_sha256":{"$ref":"#/$defs/sha256","const":"sha256:27a53f5853fa09e318d3de9a474b97102646d630140d056633146dd960881738"},"required_check_set_version":{"const":"production-av-qc-v1"},"runner_schema_version":{"const":"production-qc-runner-v1"},"schema_version":{"const":"production-qc-collector-policy-source-v1"}},"required":["collector_registry_sha256","fixed_environment_sha256","profile_id","registry_snapshot_sha256","required_check_set_version","runner_schema_version","schema_version"],"title":"ProductionQcCollectorPolicySource","type":"object"}