{"collector_registry_sha256":"sha256:285cbd72a611ea4fe3bded0a2dd0774a90b89fc3f52eeef146ecc03150c18e7e","fixed_environment_sha256":"sha256:1d36b32cd19a15c1e5d98f1ac689b632b8ebde9a41a24cbb0185844a13728e78","profile_id":"production-av-qc-v1","registry_snapshot_sha256":"sha256:27a53f5853fa09e318d3de9a474b97102646d630140d056633146dd960881738","required_check_set_version":"production-av-qc-v1","runner_schema_version":"production-qc-runner-v1","schema_version":"production-qc-collector-policy-source-v1"}